[
  {
    "id": "sy-example-governorate-example-locality",
    "governorateId": "sy-example-governorate",
    "districtId": "sy-example-governorate-example-district",
    "subdistrictId": "sy-example-governorate-example-district-example-subdistrict",
    "kind": "city",
    "name": {
      "en": "Example Locality",
      "ar": "\u0645\u062d\u0644\u0629 \u0645\u062b\u0627\u0644"
    },
    "aliases": [],
    "centroid": null,
    "externalIds": {},
    "sourceIds": ["fixture-source"],
    "sourceStatus": "seed",
    "notes": "Fixture record only. Do not copy into canonical data."
  }
]
